{
  "kind": "case_presentation",
  "schemaVersion": "0.1.0",
  "publicId": "two-station-control",
  "caseRef": {
    "documentId": "connected-control",
    "schemaId": "urn:disclosureos:experimental:case-record:0.1.0",
    "sha256": "3f4f0b0c3aa9a0910d4c3e47b65d33c640984cb1a699a7682a6be779ff6a364a"
  },
  "title": "Two station records",
  "summary": "A fictional case showing separate observations and competing reviews.",
  "updatedAt": "2026-09-12T12:00:00Z",
  "status": "published",
  "citations": [
    {
      "id": "case",
      "label": "Fictional case record",
      "target": {
        "kind": "case"
      }
    },
    {
      "id": "log",
      "label": "Station A log",
      "description": "Public citation to a fictional source.",
      "target": {
        "kind": "artifact",
        "observationId": "capture-a",
        "ref": "source:log"
      }
    }
  ],
  "blocks": [
    {
      "id": "overview",
      "heading": "What the records describe",
      "text": "Two observations are grouped for review. Their order does not establish a shared object.",
      "citationIds": [
        "case",
        "log"
      ]
    }
  ],
  "findings": [
    {
      "id": "review-a",
      "claimId": "finding-revised",
      "title": "Review remains inconclusive",
      "summary": "The revised assessment considers both reported conclusions.",
      "reviewerLabel": "Reviewer A",
      "citationIds": [
        "case"
      ],
      "historyRef": {
        "documentId": "case-review-control",
        "schemaId": "urn:disclosureos:experimental:case-claim-history:0.1.0",
        "sha256": "ec23b6af5ccb7d84a7a8b000501557ce930641815313ab46d0d9aeced434d335"
      }
    },
    {
      "id": "pending",
      "claimId": "corroboration-pending",
      "title": "Independence has not been assessed",
      "summary": "The case does not establish independent corroboration.",
      "reviewerLabel": "Review pending",
      "citationIds": [
        "case"
      ],
      "historyRef": {
        "documentId": "case-review-control",
        "schemaId": "urn:disclosureos:experimental:case-claim-history:0.1.0",
        "sha256": "ec23b6af5ccb7d84a7a8b000501557ce930641815313ab46d0d9aeced434d335"
      }
    }
  ],
  "attachments": [
    {
      "id": "station-log",
      "kind": "data",
      "role": "supporting",
      "observationId": "capture-a",
      "ref": "source:log",
      "sha256": "91b1c66fba6cfd767876cb308bb1a3cb795f69a6ffdbab7ddf8f123ce1a6eb03",
      "caption": "Fictional station log",
      "credit": "DisclosureOS example",
      "rights": "Fictional example for software testing.",
      "citationIds": [
        "log"
      ]
    }
  ],
  "featuredAttachmentId": "station-log",
  "notices": [
    {
      "id": "scope",
      "kind": "scope",
      "text": "Synthetic demonstration. A supplied assessment outcome is not a scientific finding by DisclosureOS."
    }
  ]
}
